{
  "@context": "https://linked.art/ns/v1/linked-art.json",
  "id": "https://linked.art/example/provenance/durand_payne/1",
  "type": "Activity",
  "_label": "Purchase of Spring by Payne",
  "classified_as": [
    {
      "id": "http://vocab.getty.edu/aat/300055863",
      "type": "Type",
      "_label": "Provenance Activity"
    }
  ],
  "identified_by": [
    {
      "type": "Name",
      "classified_as": [
        {
          "id": "http://vocab.getty.edu/aat/300404670",
          "type": "Type",
          "_label": "Primary Name"
        }
      ],
      "content": "Purchase of Spring by Payne from Durand-Ruel"
    }
  ],
  "timespan": {
    "type": "TimeSpan",
    "begin_of_the_begin": "1909-01-01T00:00:00Z",
    "end_of_the_end": "1909-12-31T23:59:59Z"
  },
  "part": [
    {
      "type": "Acquisition",
      "_label": "Ownership of Spring to Payne",
      "transferred_title_of": [
        {
          "id": "https://linked.art/example/object/spring",
          "type": "HumanMadeObject",
          "_label": "Spring"
        }
      ],
      "transferred_title_from": [
        {
          "id": "https://linked.art/example/person/durand",
          "type": "Person",
          "_label": "Durand-Ruel Gallery"
        }
      ],
      "transferred_title_to": [
        {
          "id": "https://linked.art/example/person/payne",
          "type": "Person",
          "_label": "Oliver Payne"
        }
      ]
    }
  ]
}